{
  "required" : true ,
  "$schema" : "http://json-schema.org/draft-03/schema" ,
  "type" : "object" ,
  "properties" : {
    "href" : {
      "type" : "string" ,
      "required" : false
    } ,
    "accountStore" : {
      "type" : "object" ,
      "required" : false ,
      "properties" : {
        "href" : {
          "type" : "string" ,
          "required" : false
        }
      }
    } ,
    "application" : {
      "type" : "object" ,
      "required" : false ,
      "properties" : {
        "href" : {
          "type" : "string" ,
          "required" : false
        }
      }
    } ,
    "listIndex" : {
      "type" : "number" ,
      "required" : false
    } ,
    "isDefaultAccountStore" : {
      "type" : "boolean" ,
      "required" : false
    } ,
    "isDefaultGroupStore" : {
      "type" : "boolean" ,
      "required" : false
    }
  }
}